"ID","Type","Name","Documentation","Specialization"
"id-9d2fd91296d245dfa91fa67677bba25a","BusinessRole","L3 Supply and Demand Management","Manages the interaction between sellers of a resource and the buyers for that resource.",""
"id-763646b4361c42ae96b25301e8cbc0d0","BusinessRole","L3 Support Services","Handles the back-office support of a channel including call centers, mail centers, systems support, and process support.",""
"id-12d680638b1d4ec89b5d82389d179361","BusinessRole","L3 Support Services","Handles the back-office support of a channel including call centers, mail centers, systems support, and process support.",""
"id-0dda5b1ccb8040848d6232e54f1ff930","BusinessRole","L3 Support Services","Handles the back-office support of a channel including call centers, mail centers, systems support, and process support.",""
"id-85f9ca5770324d75aef4a15236aa6430","BusinessRole","L3 Training","Handles the teaching and development of skills and knowledge that relate to specific useful competencies.",""
"id-7bc9a60ea6e14ec0b9c20037df42ea8f","BusinessRole","L3 Treasury Risk Management","Handles the risks associated with the management of an organization's holdings, including liquidity, currency, interest, rates, and treasury operations.",""
"id-b1e899db7e964cf580124730a0020f52","Stakeholder","Account Manager","An Account Manager is a person who is responsible for the management of a collection of customer or client relationships, typically focusing on customer and client acquisition and retention strategies.",""
"id-57327a06b6bd45d69bc06050d5436e8b","Stakeholder","Auditor","An Auditor is an individual who gathers, reviews, analyzes, and reports on the financial, legal, or other records of the organization.",""
"id-17965031320f4ab98b02be118ebac718","Stakeholder","Authorized Representative","An Authorized Representative is a person who has the authority to establish a new agreement and ensure it complies with company policy. ",""
"id-69526f42e3f64906806caa8a78a8c2e3","Stakeholder","Borrower","An Individual or organization in debt to the bank.",""
"id-7e901b95eefe48c4ad59e7199db5f606","Stakeholder","Broker","A Broker is a individual or organization with a licence to  match a buyers and sellers without themselves being party to the transaction, for a fee or commision.",""
"id-61c96b1c88024a10905d0e5cf6a6bffb","Stakeholder","Broker-Dealer","A Broker-Dealer is a brokerage firm with a licence to as a market maker for securities. In other words, is allowed to keep risky financial positions in its own balance sheet awaiting to transact with its customers. The difference between a market maker and a broker dealer is that a broker dealer is not obliged to give its customers two-way prices.",""
"id-e9546df0b0394bdeb805420e70795fbb","Stakeholder","Business Analyst","An individual eliciting, prioritizing, validating and communicating the organization's business need to interanal and exteral stakeholders. ",""
"id-3a07a0fed4cd42e786a391caf1d9fa3c","Stakeholder","Central Clearing Counterpart","An organization that steps into a bilateral derivative instrument transaction simultaniously as a buyer and a seller, assuming the default risk for both original parties. ",""
"id-7fd0e8693cf345f78f0a99d47e9dd85f","Stakeholder","Channel Manager","A Channel Manager is a person who manages the operations, including the production and supply of a channel of distribution. ",""
"id-3a7c1b8399594973858d6685bf1bac2e","Stakeholder","Clearing Counterpart","An Individual or organization part to a clearing of financial instrument, including cleared derivative transaction agreement.",""
"id-546dd5a781d64cf7bafad8b9e1ca775a","Stakeholder","Collateral Appraiser","A Collateral Appraiser is a licensed or certified appraiser who provides a valuation for collateral used to secure a loan. ",""
"id-b140c7a9b3524f2eabc38bcfe02bc5be","Stakeholder","Communications Consultant","A Communications Consultant is a person who provides advice and participates in the development of communication plans and strategies, messaging, and associated media.",""
"id-a5f2d88de0a34dbbabb929edb4e0d643","Stakeholder","Compliance Officer","A compliance Officer is a person tasked with assuring the organisation that guidelines and policies are implmented and adhered too.",""
"id-e5f4c5bd1fc04d9e83685057717c3410","Stakeholder","Corporate Finance Specialist","An individual who assist customers to raise financial resources through the issuance of financial instruments, either as a public offering or a private placement to targeted investors",""
"id-d7201fe32c584e489efc164a9bec1688","Stakeholder","Credit Risk Analyst","A Credit Risk Analyst is a person who evaluates the credit risks of a transaction and determines whether credit should be extended to the requesting party. ",""
"id-7fb973e4efc442628b6a8be979578837","Stakeholder","Customer Service Advisor","A Customer Service Advisor is a person who assists with resolving inquiries regarding an individual transaction in progress or an established agreement. ",""
"id-3b5874669ec44af79f54a55f84a8429c","Stakeholder","Delivery Manager","A Delivery Manager manages the development and launch of new products or services for a channel from idea to deployment, including post-deployment success. ",""
"id-ee69cab49f64444c93f16fb3844d3e08","Stakeholder","Financial Account Holder","A Financial Account Holder is an individual or legal entity who has, plans to have, or had an agreement in place for a savings, checking, or related financial account.",""
"id-95f6d501f1c948e59ebc57e83c1ca4d2","Stakeholder","Financial Controller","A Financial Controller is a person who is responsible for accounting activities and overseeing financial reporting, including balance sheets and revenue models. ",""
"id-9d48dfbad40a4a08b7d292b1c046f560","Stakeholder","Financial Instrument Analyst","A Financial Instrument Analyst is a person who evaluates a financial instrument for the purposes of packaging it for trading and delivery to investors. ",""
"id-8e66f498d1ae4da9a66b946bf052d662","Stakeholder","Financial Instrument Sales Advisor","A Financial Instrument Sales Advisor is a person who uses the financial instrument evaluations to determine the packaging and trading terms with investors. ",""
"id-318e2b1cb38a4b36a87e70e7f1c81b97","Stakeholder","Financial Planner","A Financial Planner is a qualified investment professional who provides a service to help individuals and corporations meet their long-term financial objectives by analyzing the client’s status and setting a program to achieve that client’s goals.",""
"id-2d1fb36a96da428d9002c4714f43fcee","Stakeholder","Investment Account Holder","An Investor Account Holder is an individual or legal entity who has, plans to have, or had an agreement in place for a safekeeping of financial assets in a fidicuary account.",""
"id-82bcf571f70d4b80adac2ff735a301ff","Stakeholder","Investment Management Company","An organization regognized by regulation who's primary business is making investment decisions on behalf of their customers  with the objective to optimize the risk/return of an investment portfolio.",""
"id-ce2d80799db04a3e9dac8c0f065e3dea","Stakeholder","Investment Manager","An Investment Manager (also known as a Fund Manager or Portfolio Manager) is responsible for determining the strategy and investment portfolio as well as managing the assets to generate revenue and wealth for the organization. ",""
"id-bae112f2d974442e929be7e529ab99c5","Stakeholder","Investor","An Investor is a person or organization that commits capital with the expectation of financial returns. ",""
"id-cf193a960b3f41c0ab6b5071937f81f0","Stakeholder","IT Architect","An IT architect is responsible for the design and evolution of the IT environment.",""
"id-c70121b8f4e6475f8419d727b76b3da4","Stakeholder","IT Engineer","An IT Engineer is responsible for the development and maintenance of all layers of systems within an organization, from the physical hardware to the operating systems, applications, databases, storage, and servers.",""
"id-3809dd9d5a404e2fb8339901fdc69600","Stakeholder","IT Technology Lead","An IT tech. lead is a subject matter expert in a particular area of the IT architecture. For example cyber security, or cloud technology.",""
"id-a81597ee41fd4d27b05577f1728fd715","Stakeholder","Legal Counsel","A Legal Counsel is a person who is legally qualified and licensed to represent an organization in a legal matter, such as lawsuits, policy formations, contract negotiation, and patent activities. ",""
"id-b60e39f824524b5bbe0bebea58c11001","Stakeholder","Legal Specialist","An individual establishing, reviewing legal documentation, and provides legal opinion on a wide range of activities within the organisation.",""
"id-12b74fb4e59f406b8e1053e206c1c369","Stakeholder","Lender","An Individual or organization to which the bank is in debt.",""
"id-4ce585ee60c54ce89bb86f35fa5e1d24","Stakeholder","Market Maker","A Market Maker is a broker-dealer firm with a license to assume the risk by stepping into the transaction as an intermediary. A market maker is obliged to provide the market with both a sell and buy price without knowning the counterpart's intention to either purchase or sell the instrument/risk.",""
"id-a1372fd1fddd4995a77fe2463ca1acab","Stakeholder","Marketing Manager","A Marketing Manager is a manager whose primary task is to manage the marketing resources of a product or business.",""
"id-935d1387f22249e3b8678376932b0c91","Stakeholder","Operations Analyst","An Operations Analyst is a person who helps in proposing  how to orginaze the daily actvities (workflow)  to fulfill the products and services of an organization.",""
"id-fa9b4f12340146468567072e81f0f408","Stakeholder","Operations Manager","An Operations Manager is a person who decides how to organize daily activites and manage the daily operations delivering the products and services of an organization.",""
"id-74e7cfa800c84025af32fcc71dc0a7f3","Stakeholder","Product Manager","A Product Manager is a person who manages the development of products and services for an organization, performing activities such as market analysis, competitive analysis, maintaining product roadmaps, and managing product launch from ideation to development and deployment.",""
"id-cafa453071f342c2b14b38df95c903a1","Stakeholder","Product Specialist","A Product Specialist is a person who possesses deep knowledge of a product or product line and can determine appropriateness for individual customers.",""
"id-8652c5205dec455383159f8bdf39eb5c","Stakeholder","Program Manager","A Program Manager is a person in charge of the planning and execution of a particular initiative.",""
"id-bf0ed8b8ad63439baac556c3ca44515d","Stakeholder","Public Records Administrator","A Public Records Administrator maintains documents and information that is determined to be public information (e.g., property/land registry) and makes that accessible to the general public. ",""
"id-ac0aacc06a654982a6313f0a4ae21cb9","Stakeholder","Quality Assurance Analyst","A Quality Assurance Analyst is responsible for applying the principles and practices of software quality assurance to thoroughly test software changes throughout the development life cycle.",""
"id-bf4fc5edae5d462b9d6a4ecfa05ef3f4","Stakeholder","Regulatory Auditor","A Regulatory Auditor is responsible for developing, implementing, and enforcing regulations that govern financial transactions, and market particpant behaivor. ",""
"id-706f47067bce414d8f7e3b3dd13c696f","Stakeholder","Risk Officer","A Risk Officer is a person responsible for implementing,identifying, analyzing, and mitigating internal and external events that could threaten a company providing the first line of defence.",""
"id-cc256913c191419098a3224c0a8f9197","Stakeholder","Strategist","A Strategist is responsible for evaluating both the internal and external environment and providing advice to an organization to help achieve their strategic business priorities.",""
"id-f5e1ef0a837445e69d6ddd7f97ee8890","Stakeholder","Trader","A Trader is an individual  involved in initiating and managing financial positions by purchasing and selling financial assets. trading, market-making, and subsequent operations. A trader has the mandate to enter into financial agreeements on behalf of an organization.",""
"id-36c70e7831264aaf82ef10b4154c0c80","Stakeholder","Trading Counterpart","An individual or organization part to a trading for securities, cash and or derivative's agreement.",""
"id-1df4877a3bc94a9eacfa5332cc61b200","Stakeholder","Trading Venue","An organized market place where buyers and sellers meet to establish a transparent and fair market price for financial instruments, including both securities and standardized derivatives.",""
"id-caa9b697ad6c44398656ade32a6b39ab","Stakeholder","Trainer","A Trainer is a person who acquires in-depth skills and knowledge in order to train an organization’s workers. ",""
"id-7d5e6fbedb974c6393af0ccd806c95a7","Stakeholder","Treausurer","An individual with the responsibility to  optimize the use of the organizations financial assets and financial liabiliites. This includes making funding decisions and managing the timing of of cash in- and outflow as well as managing the risk and return ",""
"id-aca693d58ba94ed5b1b030e88b8787d2","Stakeholder","Trust Bank (Custodian)","A Trust Bank (Custodian) is a legal entity that acts as a fiduciary, agent, or trustee on behalf of a person or business entity for the purpose of administration, management, and the eventual transfer of assets to a beneficial party.",""