"ID","Type","Name","Documentation","Specialization"
"id-4bb4b2d6","ArchimateModel","ServiceNow","",""
"id-0609e555","BusinessActor","Budget Admin","Role: budget_admin",""
"e08c04f4","BusinessActor","Budget Analyst","Role: ?",""
"id-2f46ec2b","BusinessActor","Budget Key Owner","Budget key owners are also users in the instance that you can associated with a budget key, and thereby budget plans as well. Budget key ownership can be full or limited:

Full access allows the owner to access everything associated with the budget key, including budget plans and forecasts, targets, and budget key expenses.
Limited access allows the owner to see only the budget plans they own and the items in those plans.
Budget key owners also have the same level of access to the items associated with child budget keys.",""
"id-0a7bd17b","BusinessActor","Budget Owner","Budget owners can view all items that budget keys are associated with, such as budget plans and forecasts.

Budget owners are users in the instance that you can associate with a budget plan. Create a budget owner record to give a user the budget_owner role, which grants access to budget plans and forecasts.",""
"id-8dab2caa","BusinessActor","Company","",""
"ef73bdc7","BusinessActor","Cost Admin","cost_transparency_admin",""
"id-075fbf35","BusinessFunction","Accounting","",""
"id-8a503796","BusinessProcess","Budgeting","",""
"id-8aed9f55","BusinessProcess","Charging","",""
"f47e0d68","BusinessProcess","IT Financial Management","",""
"ff894a0a","ApplicationCollaboration","GL Data Import","Financial data resides in the General Ledger Staged Data table.

You can import financial data into the General Ledger Staged Data [itfm_gl_data_staged] table by using either of the following methods:

Import sets
Easy import
See Import sets.
Attention: Be sure that your fiscal calendar can be used with your financial data.",""
"id-8f42a49a","ApplicationComponent","Allocation Engine","The core of the application that uses your cost model to calculate expenses and determine how to allocate expenses.",""
"id-9e5881db","ApplicationComponent","Application Component","Configuration Management",""
"id-61db4962","ApplicationComponent","Asset Management","",""
"id-152ed138","ApplicationComponent","Cost Management","",""
"id-8e9c9750","ApplicationComponent","Financial Management","",""
"id-2ea1db1a","ApplicationComponent","Financial System","",""
"id-19ff834b","ApplicationComponent","General Ledger","",""
"bd988b18","ApplicationComponent","Project Management","",""
"b0f6f900","ApplicationComponent","Service Catalog","Configuration Management",""
"f4ab94d8","ApplicationComponent","ServiceNow","",""
"f34c0571","ApplicationFunction","Add items to a budget plan","After you create a budget plan, add items to the plan, such as assets and configuration items. You can then track the estimated target cost of all the items in the budget versus the actual costs.

Before you begin

Role required: budget_admin
Procedure

Open a budget plan.

Click one of the related lists.

Click New.

Fill out the fields on the form (see table).

Right-click the form header and select Save.

The application calculates the breakdowns automatically.

Click Recalculate Item Amount if you update budget reference rates.

Table 1. Form fields for budget plan items
Field Available for these types of items Description
Name All types A descriptive name for the item. Enter a name. If you select a product model, the application automatically populates this field and makes it read-only.
Budget Plan All types The plan this item belongs to.
Budget Key All types The budget key for this item. You can select a key that is designated as a sub-key of the plan's key. Use this sub-key if you want items to be separated by different codes and assign those keys to different users. Items without a key take the key of the plan.
Account Number All types The account number associated with this item.
Expense Type All types If the item is an Operational or Capital expense. The account determines this value.
Configuration Item Budget item, Software, Hardware The CI in the Configuration Item [cmdb_ci] table.
Item Cost in Plan Currency All types The actual item cost for the number of units and the cost per unit. This field uses the currency that the budget uses.
Product Model Budget item An item from the product catalog's Product Model [product_model] table. This field is new with the Helsinki release. See Models.
Item Cost in Local Currency All types The actual item cost for the number of units and the cost per unit. This field uses the local currency selection that you make on the Cost Details tab.
User Labor The user performing the labor. Select a user from the system.
Contract Contracts The contract from the [ast_contract] table. Select a contract.
Cost Details
Local Currency All types Select the currency that pertains to the cost of this particular item.
Unit Cost in Local Currency All types The cost of each unit in the item. Enter the cost per unit.
Quantity All types The number of units in this item. Enter the quantity of this item.
Is Prorated All types, except Asset Depreciation The breakdown is prorated if the start or end date falls in the middle of the time period for a breakdown record. Select this option to prorate the amount. This field is automatically selected and is read only for external labor.
Is Monthly All types, except Asset Depreciation Assumes the amount entered in the Unit Cost in Local Currency field is not incurred annually, but monthly. The amount is then applied across the entire fiscal period until the specified end date. This field is automatically selected when Is Prorated is selected, and is read only for the external labor item type.
Item Execution
Planned Execution Start Date All types, except Asset Depreciation and Contract The date when this item is estimated to begin incurring an expense. The planned dates can determine which budget item breakdowns receive cost values.
Actual Execution Start Date All types, except Asset Depreciation The date when this item actually begins incurring an expense. The actual dates take precedence over the planned dates in determining which budget item breakdowns receive cost values.
Planned Execution End Date All types, except Asset Depreciation The date when this cost is estimated to stop incurring an example. The planned dates can determine which budget item breakdowns receive cost values.
Actual Execution End Date All types, except Asset Depreciation The date when this item actually stops incurring an expense. The actual dates take precedence over the planned dates in determining which budget item breakdowns receive cost values.",""
"id-86d83799","ApplicationFunction","Assign","Assign budget key to budget owner",""
"id-08b505e8","ApplicationFunction","Copy a budget plan","You can use any plan as a basis for creating a new plan.

Before you begin

Role required: budget_admin
About this task

When you copy a plan, an exact replica of the plan and all its items is created, with the word copy appended to the name.

Procedure

Navigate to Financial Planning > Budget Planning > Budget Plans.

Click a plan to open the Budget Plan form.

Click Copy Plan.",""
"id-02281798","ApplicationFunction","Create Budget Model","Create a budget model that can be used by cost allocations and budgets.

Before you begin

Role required: budget_admin
About this task

When you are creating a budget model, select segments in a hierarchy and then generate a budget key for the model.

Procedure

Navigate to Financial Planning > Administration > Budget Model.

Click New.

Fill out the fields on the Financial Model form (see table).

Right-click the header and select Save.

Table 1. Budget Model form fields
Field Description
Name A descriptive name for the model.
Data Source The source of the financial data. Use the General Ledger Staged source. Only use the Cost Plan Breakdown if you activate and use the Project Portfolio Suite with Financials (com.snc.financial_planning_pmo) plugin. Portfolio actuals do not come from the staged general ledger. They are located in cost plan breakdowns in the Project Portfolio Suite.
Model Owner The user who owns the model.
Used by Cost Allocation If the model can be used by cost models. You can select this option if you also want the budget model to be used as a cost model.
Used by Budgeting If the model can be used by budgets. Select this option.
Description A detailed description for the model.
Important budget model actions
Generate Budget Keys Creates budget keys based on the segment relationships.
Generate Actuals Creates financial actuals in the Budget actuals table [itfm_gl_actuals], which the budget console and the budget variance report use.
Related list
Segment Relationships The relationships between the segments associated with this budget model. The segments are used when you generate budget keys for the model. Create segments relationships as necessary.",""
"id-1891a735","ApplicationFunction","Create Budget Plan","After you have configured your budget target and account codes, create a budget plan.

Before you begin

Role required: budget_admin, budget_analyst, budget_owner
About this task

This procedure explains how to create a budget plan with a blank form. You can also copy an existing budget plan.

Procedure

Navigate to Financial Planning > Budget Planning > Budget Plans.

Click New.

Fill in the Budget Plan form fields (see table).

Right-click the form header and select Save from the context menu. The related lists and links appear.

Click Preview to see what your budget plan would look like. The Budget Preview window looks like the Budget Console, except that you cannot change the budget model, budget key, or fiscal period. The data comes from the pre-promoted budget plan and includes sub-plans.",""
"id-03c5d0fc","ApplicationFunction","Create Budget Targets","A budget target is an estimated amount of money for a specific fiscal period and budget key combination for operating and capital expenses. Use budget targets to set up a financial goal for a budget plan.

Before you begin

Role required: budget_admin, budget_analyst, budget_owner
Procedure",""
"id-91c9d084","ApplicationFunction","Create Business Units","Create business units to set up the top-most segment in the IT chart of accounts. Then you can create rollup rules to have expenses roll up to these business units.

Before you begin

Role required: cost_transparency_admin
Procedure

Navigate to Cost Transparency > Chart of Accounts > Business Units.

Click New.

Fill out the fields on the form (see table).

Click Save.

Table 1. Business Unit form fields
Field Description
Name Name of the business unit.
Company The company, if any, associated with this business unit. You can choose any company, including those that do not have the Vendor field selected.
Description A description of the business unit.
Related List
Departments Departments that comprise this business unit. Add as many departments as necessary.",""
"a9ee62a3","ApplicationFunction","Create GL account","Create a general ledger account for each account in your organization that requires an account number to associate expenses with.

Before you begin

Role required: cost_transparency_admin
About this task

Accounts are associated with all three types of expenses in the general ledger.

Starting with the Helsinki release, account numbers are classified as either an operating expense or a capital expense. This expense type is expressed in budgets to compare operating and capital budget targets versus actual budgeted expenses.

After you upgrade Financial Management to the Helsinki version, the Expense Type field defaults to Operating.

Procedure

Navigate to Financial Planning > Administration > Accounts.

Fill out the form fields (see table).

Click Submit.

Table 1. General Ledger Account form fields
Field Description
Account Number Enter a unique account number for each account.
Description Enter a detailed description for the account.
Name Enter a descriptive name.
Expense type Select the type of expense associated with the account:
Operating: An operational expense. If you upgrade to Helsinki from a previous release, all accounts default to this type.
Capital: A capital expense.
Note: After you upgrade Financial Management to the Helsinki version, this field defaults to Operating.",""
"id-84baf3d1","ApplicationFunction","Create Manually","Create a budget key manually when you want to specify specific segment records that comprise the key, as allowed by the budget definition.

Before you begin

Role required: budget_admin
Procedure

Navigate to Financial Planning > Administration > Budget keys.

Click New.

Fill out the form fields (see table).

Click Submit.

Table 1. Account Code form fields
Field Description
Name Descriptive name for the account code.
Segments The segments associated with this budget key. These segments are set in the budget model in the Segment Relationships related list. Select a value for the root segment identified in the budget definition.",""
"id-545b9b14","ApplicationFunction","Generate Actuals","",""
"id-903f187e","ApplicationFunction","Generate Actuals","After you have configured your budget target and account codes, create a budget plan.

Before you begin

Role required: budget_admin, budget_analyst, budget_owner
About this task

This procedure explains how to create a budget plan with a blank form. You can also copy an existing budget plan.

Procedure

Navigate to Financial Planning > Budget Planning > Budget Plans.

Click New.

Fill in the Budget Plan form fields (see table).

Right-click the form header and select Save from the context menu. The related lists and links appear.

Click Preview to see what your budget plan would look like. The Budget Preview window looks like the Budget Console, except that you cannot change the budget model, budget key, or fiscal period. The data comes from the pre-promoted budget plan and includes sub-plans.",""
"b23efb5d","ApplicationFunction","Generate Budget Keys","Budget keys can be generated using Generate Budget Keys from the model. To generate budget keys, the segments used in the budget model have to be mapped to the data source column in the field map, if by default they were not mapped already. By default, the application has field mapping with cost center, vendor, location, department, and project. If you are using any code combination segments in the budget model hierarchy other than these segments mentioned, then it has to be explicitly mapped in the data source field map.

If there is an error when you manually generate budget keys, then verify the data source field map.",""
"id-7930a261","ApplicationFunction","Generate from model","Generate budget keys from a budget model if you do not want to create them manually one by one.

Before you begin

Role required: budget_admin
About this task

Procedure

Navigate to Financial Planning > Administration > Budget Model.

Open the desired budget model.

Ensure that your mappings are defined on all the segments used in the model hierarchy.

Click the Generate Budget Keys button at the bottom of the list.

If you add more general ledger data and generate the keys again, the application generates only new keys based on the changed data. It does not regenerate the same keys, nor does it create duplicate keys.",""
"ea54df95","ApplicationFunction","Override forecast","f you do not want to keep the forecast amount, you can override it with a value of your own.

Before you begin

Role required: budget_admin
About this task

You can also override the amounts in budget breakdowns. The override value is used in the forecast's Amount field. However, any value you use as an override in the forecast completely overrides the value in the Amount field.

If you are using the budget console, you can edit the value of the Override column if you add that column to the view on the Review tab. See The budget console for more information.

Procedure

Navigate to Financial Planning > Budget Planning > Budget Forecasts.

Open a forecast.

Enter the override value in the Override Amount field.

Select an optional Override Category. See Create a budget override category for more information on these categories.

Enter comments in the Override Note field.

Click Update.",""
"id-7f089ff2","ApplicationFunction","Promote a budget plan","After you review the budget plan and agree to the numbers, you can promote it to a forecast. The forecast becomes a benchmark for the same fiscal period specified by the plan.

Before you begin

Role required: budget_admin
Note: All items must have an account number associated with them before you can promote the budget plan.
Procedure

Open a budget plan.

Click Promote.

Note: The application creates a forecast and a read-only copy of the project plan that the forecast refers to. This allows you to modify the project plan without changing the forecast.
Navigate to Financial Planning > Budget Planning > Budget Forecasts.

Click the forecast Display Name to open it.

Verify the information on the form and related lists (see table).

If you make any changes, click Update.

Field Description
Display Name The name derived from the budget plan
Budget Key The budget key used by the plan.
Account Number An account associated with the forecast.
Budget Owner The budget plan's owner, who also has access to this forecast.
Budget Plan The budget plan from which the forecast was derived.
Fiscal period The fiscal period from the budget plan.
Amount The Budget Amount from the plan. This value populates the Final Amount field unless you use an override.
Override Amount An amount that can replace the amount in the Final Amount field. Enter an amount if you want to ignore the value in the Amount field.
Final Amount The final amount that is taken from the Amount field, or, if you are using an override, the Override Amount field.
Override Category The category for the override.
Target The target amount for the account code on the budget forecast. The target amount may not be the same as the target on the budget plan because there may be multiple account codes on the budget plan that each generates a budget forecast. This is because the budget forecast is for a fiscal period + account code combination.
Related Lists
Breakdown A breakdown of the Amount value into monthly units. Double-click the fields in the list to edit them or click the record icon to open the breakdown.
Budget Forecast Items The items inherited from the budget plan.",""
"id-335241d2","ApplicationInterface","Budget Console","The target amount also appears on the Review tab of the Budget Console. You can edit the amount through the console.",""
"id-49695135","ApplicationInterface","View expenses","You can view records in any of the general ledger tables and make changes if necessary.

Before you begin

Role required: cost_transparency_admin
Procedure

Navigate to Cost Transparency > General Ledger and open one of these general ledgers: Staged Expenses, Cleansed Expenses, Groomed Expenses.

Open an expense by clicking the value in the Number column for the expense.

Modify the fields on the form as appropriate (see table).

Click Submit.

Table 1. Groomed General Ledger Data form fields
Field Description
Number Auto-generated identification number for the general ledger data record.
State The current state of the record:
Unallocated: Allocations for this expense are not allocated.
Allocated: This expense has been allocated.
Locked: The general ledger expense is locked so that its allocation lines cannot be reverted.
Account name Name of the account.
Account number Account number this expense applies to. This field is mandatory on the Cleansed General Ledger Data form to ensure that all cleansed expenses appear in an account in the Bucketing stage of the workbench.
Description Detailed description of the expense.
Amount The amount of the expense.
Cleansed expense [General Ledger Staged Data form]
A reference to the corresponding record in the General Ledger Cleansed Data table. This is the expense in the General Ledger Cleansed Data table that is automatically created when you create an expense in the General Ledger Staged Data table.

Staged expense [General Ledger Cleansed Data form]
A reference to the corresponding record in the General Ledger Cleansed Data table.

Groomed expense [General Ledger Cleansed Data form]
A reference to the corresponding record in the Groomed General Ledger Data table.

Grooming rule [General Ledger Cleansed Data form]
The condition that the workbench uses to filter expenses that are put in buckets.

Currency Currency that the expense is valued in. The currency is a three letter code defined in the Currency [fx_currency] table. If the value in this field does not match any code in the Currency table, dollar signs are displayed by default for all expenses. Make sure that your expenses in all general ledger forms are in the same currency as your system currency.
Document amount Amount of the original expense document.
Document currency Currency that the original expense document uses. As with the Currency field, the value in the field is a three letter code defined in the Currency table.
Bucket [Groomed General Ledger Data form]
Bucket that this expense is associated with.

Sub-bucket [Groomed General Ledger Data form]
Sub-bucket that this expense is associated with.

Cost center Cost center this expense applies to.
Department Department associated with this expense.
Fiscal period [Groomed General Ledger Data form]
Period during which this expense occurred.

Document date Date on which the original expense document was issued.
Import set The import set containing the data that you imported into the instance.
Location The location of where the expense was incurred.
Vendor The vendor record that is referenced from the Company [core_company] table.
Posting date The date of when this expense was incurred.
Local amount The amount represented in the local currency.
Local currency The currency associated with the account.
Segments Expense amounts for the segments that are defined in the IT chart of accounts.
Related links
Preview Allocation [Groomed General Ledger Data form]
Opens the allocation viewer for unallocated expenses. This link does not appear on the form for allocated expenses.

Visualize Allocation [Groomed General Ledger Data form]
Opens the allocation viewer for allocated expenses. This link does not appear on the form for unallocated expenses.

Related Lists
Cost Allocations [Groomed General Ledger Data form]
Allocation lines created from this expense.

General Ledger Cleansed Data [Groomed General Ledger Data form]
The records in the General Ledger Cleansed Data table that created the groomed expense records after the expenses are put into buckets.",""
"id-32acda7d","ApplicationInterface","Workbench","Financial Management Workbench",""
"d9fe1e40","ApplicationService","Financial Reports and Dashboards","Graphical representations of the expense allocations that show you where your expenses are coming from.",""
"id-50bb7671","ApplicationService","Import budget data","You can use the platform's Easy Import feature to import budget data into the Budget Item table. A transform map is available by default to transform the data and create a budget plan, account code, budget items, and a budget owner.

Before you begin

You must set up a budget definition. Configure the spreadsheet with any or all the following columns, which represent segments:
Department
Location
Vendor
Cost Center
Business unit
Business service
Portfolio
Project
Shared service
Custom columns (up to four): additional segments.
You do not need all of these columns. Only include the ones you need for your budget data. The values in each of the rows is the same as the value in the Name field of each of the segments.

You must be familiar with the Easy import feature and transform map scripts. The transform map used in this topic is named importBudgetItemTranform.

See Import sets.

Role required: budget_admin
About this task

The transform map performs the following actions:

Concatenates strings to provide an account code.
Gets an account code by querying the account codes or by creating a new one.
Creates a budget item for each row in the spreadsheet.
Associates the budget items to a budget plan by finding a plan in the Budget Plan table or by creating one.
Promotes the budget plan to a forecast.
Procedure

Create a table named u_itfm_budget_stage.

Import the spreadsheet data into the u_itfm_budget_stage table using the Easy Import feature.

Run the transform map importBudgetItemTranform. This transform processes data from the Source u_itfm_budget_stage table to the Target Budget Item [itfm_budget_item] table.

Navigate to Financial Planning > Budget Planning > Final Budgets to confirm the budget data and records that were created and make modifications.",""
