"ID","Type","Name","Documentation","Specialization"
"id-2d37fcb1","ApplicationService","Use the budget variance report","Use the budget variance report
Use the Budget Variance report to see how expenses compare to budgets for cost centers, departments, locations, and vendors.

About this task

When you access this report, you can only see the budget data for the budget keys that the user in the Budget Owner choice list actually owns.

Procedure

Navigate to Financial Planning > Budget Planning > Variance. The report opens in another tab or window.

Click the gear icon (gear icon) to configure settings for the report:

Table 1. Report configuration options
Setting Description
Budget Model Shows budget data for the selected model.
Group by The main segments you want to group by. Select the segment from the choice list. To change the segments, modify the ITFM_BudgetVariance script include.
Subgroup by The segment you want to group by under the main segment. Select the segment from the choice list.
Display description instead of name How you want to display the segment in the report. Click the switch to use the display description instead of the name of the department, vendor, and so on.
Use Year-to-Date Instead of Fiscal Periods Sets the available time period for the data. Click the switch icon next to Use Year-to-Date instead of Fiscal Periods to use data for the current year. Turn off the switch to use fiscal periods, one of which you can select with the Fiscal Period choice list.
Filter the report as needed.

Table 2. Budget variance report filters
Action Procedure
Filter by a budget variance Enter the low end and high end of the range in the left and right-hand text boxes under Filter out by Variance. For example, to show only the budgets where the difference between the actual amount and the budgeted amount is between -1000 and 1000, enter (1000) in the left text box and 1000 in the right text box.
Show data for a specific fiscal period and budget model. Select the period from the Fiscal Period and Budget Model choice lists.
Show data for a specific budget owner. Select a user from the Budget Owner choice list. This list is filtered to show only the budget owners under you in the budget owner hierarchy.
Show budget data for capital or operating expenses Select the Operating or Capital check boxes
- Business Management Financial Management, Istanbul",""
"id-60d0dd58","DataObject","Breakdowns","Budget forecast breakdowns: A breakdown of the Amount value into monthly units.

The total cost in a budget forecast is divided into smaller units called breakdowns, which are taken from the budget plan.

The breakdowns are used to calculate the value in the forecast's Amount field.",""
"id-9fe51835","DataObject","Budget Actuals","Account code, or budget key, expenses are records that show general ledger amounts for a budget key. The amounts are aggregated for each fiscal period.

The expenses in the Account Code Expenses [itfm_gl_actuals] table are used by the budget console for calculations of actual expenses. Normally you do not need to create or modify data in this table.

Financial administrators can access account code expenses from the Financials > Administration > Budget actuals module. The expenses are populated when you click Generate Actuals on the Financial Model form.",""
"cc29385a","DataObject","Budget Forecast","Budget forecasts provide a projection of expenses taken from a budget plan.

You create a budget forecast by promoting a budget plan. When you do, the application creates a forecast and a read-only copy of the budget plan that the forecast refers to. This allows you to modify the budget plan without changing the forecast.

Budget forecast components

The budget forecast includes these items.

Inherited budget plan values: important values from the plan, including the budget plan key.
Overrides: an amount you can specify to override, or replace, the final forecast amount.
Budget forecast items: the budget items from the budget plan.
Budget forecast breakdowns: A breakdown of the Amount value into monthly units.
Promote a budget plan
After you review the budget plan and agree to the numbers, you can promote it to a forecast. The forecast becomes a benchmark for the same fiscal period specified by the plan.

Override a budget forecast amount
If you do not want to keep the forecast amount, you can override it with a value of your own.

Budget forecast breakdowns
The total cost in a budget forecast is divided into smaller units called breakdowns, which are taken from the budget plan.",""
"id-60c02ef2","DataObject","Budget items","The items that comprise a budget plan come from several other applications in an instance, including Asset Management, Project Management, and Configuration Management. This enables you to budget your expenses for items across your IT infrastructure.

Each item in the budget plan has an actual item cost and an account number. The actual item costs roll up to comprise the budget plan's actual budgeted amounts for both capital and operating expenses, using the type of account code (capital or operating) associated with each item. You can further refine the costs of the items by specifying how many units to include in a single item, a unit cost, and the percentage of each unit that you want to include in the actual item cost.

Starting with the Helsinki release:

you can add product catalog items to budget items. See Product Catalog for more information.
Expense type will be determine by the Account selected on the budget item.
Budget item breakdowns
The total cost in a budget plan is divided into smaller units called breakdowns.

Add items to a budget plan
After you create a budget plan, add items to the plan, such as assets and configuration items. You can then track the estimated target cost of all the items in the budget versus the actual costs.",""
"c3601efe","DataObject","Budget Key","A budget key is a unique combination of values that the application uses to identify budget forecasts and budget plans.

Note: Budget keys replace account codes, starting with the Helsinki release.

Structure

You can define the structure of the budget key by specifying the segments/code combination from the general ledger, such as the cost center, department, location, vendor, or any attributes. The budget key is a unique combination of values for these attributes. The combination of values is in a budget model hierarchy on a budget model.",""
"id-9da59fe0","DataObject","Budget Model","A budget model is the foundation of your budget.

A budget model is necessary for each budget key. Create as many budget models as necessary to classify budgeted expenses based on the segments that you can specify through their relationships.

Budget analysts and budget admins can see any budget model. Budget owners can see only the budget models associated with budget keys that the budget owner has access to.

Budget models replace budget definitions, starting with the Helsinki release.",""
"df557988","DataObject","Budget Plan","Budget plans specify expenses for assets, contracts, labor, and certain configuration items (CIs) for a fiscal period, particularly one in the future. Use budget plans as the basis to compare your actual versus planned expenses.

Budget plans are associated with a budget key and a fiscal period. If you have financial data over several financial periods, make a separate plan for each period.

There are several types of items you can add to the budget plan. The costs of these items are broken down over the fiscal period that you specify for the plan. See Budget items and Budget item breakdowns for more information.

Budget plan expense amount types

Budget plans show these types of expense amounts:

Target amounts: An amount that you set as a goal to reach or a limit not to exceed. A target amount is created for a specific fiscal period and account code combination. When you select the account code and fiscal period for the budget plan, the target amount is automatically populated in the read-only target fields. There are targets for both operating and capital expenses.
Budgeted amounts: A rollup of all the budget plan items, which appear as related lists on the Budget Plan form. Only items marked as capital expenses do not roll up to the amount fields. There are budgeted amounts for both operating and capital expenses.
Budget plan ownership

Budget plans have a single owner, who must have the budget_owner role. Whoever you chose as the budget owner must also be associated with the budget plan's budget key as an owner.

Budget plan parent-child relationships

Budget plans can have one or more sub-plans, which roll up their actual budget amounts to the parent budget plan. You cannot promote child plans individually. Only the top-level plan in a hierarchy can be promoted.

The same account codes can be used for parent and any or all child plans, if necessary. Child plans can also have account codes that are lower in the hierarchy. For example, if the parent's account code is IT finance, the child plan's account code could be IT finance > Auditing Service, or similar. If you have multiple sub-plans with the same account codes, the amounts roll up from all subplans to the forecast.

Changing the fiscal period parent plan cascades the change down to all sub-plans. See Budget owners and budget key owners for more information.

Budget plan promotion

You can promote a budget plan to a budget forecast, based on the plan's account code and fiscal period. The forecast helps you predict the expenses your organization will incur. See Budget forecasts for more information.

Create a budget plan
After you have configured your budget target and account codes, create a budget plan.

Copy a budget plan
You can use any plan as a basis for creating a new plan.

Budget items
The items that comprise a budget plan come from several other applications in an instance, including Asset Management, Project Management, and Configuration Management. This enables you to budget your expenses for items across your IT infrastructure.",""
"id-0d1a6d64","DataObject","Business Unit","Business units are the parts of your organization that are in charge of certain operations, such as Finance, HR, IT, and so on.

Business units are typically comprised of departments and associated with a company. By default, the IT chart of accounts includes a segment for business units, departments, and vendors, which are companies with the Vendor option selected. With this chart of accounts setup, you can allocate expenses to specific business units, departments, or vendors, or have expense allocations roll up to them. You can configure both departments and companies as part of user management.

Create business units
Create business units to set up the top-most segment in the IT chart of accounts. Then you can create rollup rules to have expenses roll up to these business units.",""
"c2292107","DataObject","Chart of Accounts","",""
"cfd31687","DataObject","Cleansed expenses","Cleansed expenses that the workbench uses during the Data Cleansing stage. Changes to expenses during this stage are saved in the General Ledger Cleansed Data [itfm_gl_data_cleansed] table. Each time you add an expense to the General Ledger Staged Data table, a corresponding expense is created in this table.",""
"id-8eb68cb9","DataObject","Company","",""
"id-0939c504","DataObject","Cost Model","",""
"d17ef5eb","DataObject","Department","",""
"e57b74d1","DataObject","Fiscal Period","The fiscal period: The timeframe during which expenses were incurred. You can work with only one fiscal period at a time.",""
"edadc916","DataObject","GL Account","",""
"id-6a230b49","DataObject","Groomed expenses","Groomed expenses that the workbench uses during the Bucketing stage. Changes to expenses during this stage are saved in the Groomed General Ledger Data [itfm_gl_data_groomed] table.",""
"id-122f2140","DataObject","IT General Ledger","The general ledger: A list of your organizational expenses.
the general ledger contains all expenses for your organization for all fiscal periods.",""
"id-5e7f7d9f","DataObject","Segments","",""
"id-076276ee","DataObject","Staged expenses","Staged expenses that you imported from your external source. Imported expenses are saved in the General Ledger Staged Data [itfm_gl_data_staged] table.",""
"bd7d45d8","Artifact","Account Code Expenses","[itfm_gl_actuals] table
the expenses are used by the budget console for calculations of actual expenses. Normally you do not need to create or modify data in this table.",""
"id-70ee5b05","Artifact","Account Number","",""
"id-3b16c665","Artifact","Actual Item Cost","The actual item costs roll up to comprise the budget plan's actual budgeted amounts for both capital and operating expenses using the type of account code (capital or operating) associated with each item.",""
"id-6e4996af","Artifact","Budget forecast items","the budget items from the budget plan.",""
"e843fa9d","Artifact","Budget Variance report","he Budget Variance report shows you how expenses compare to budgets for the segments in the budget definition.

The Budget Variance Report is the main report you need for managing budgets. It gives you an overview of your budget estimates versus actuals. The estimated budget data is taken from the Final Budgets [itfm_budget] table, not from forecasts. The actual expense values are taken from the General Ledger Staged Data [itfm_gl_data_staged] table.

The budget variance data is grouped by Operating and Capital expenses, starting with the Helsinki release.

Use the budget variance report
Use the Budget Variance report to see how expenses compare to budgets for cost centers, departments, locations, and vendors.",""
"f414147f","Artifact","Capital Target","Capital Target The amount of the target in the currency being used.",""
"id-3ad22a6e","Artifact","Currenc","Currency The currency in use.",""
"a970de3f","Artifact","Default Model","Default budget model: A default budget model that you can customize. If you upgrade to Helsinki, the budget definition you had in Geneva is converted to the default budget model.",""
"dbd78f41","Artifact","Inherited budget plan values","Important values from the plan, including the budget plan key.",""
"id-8f92868a","Artifact","Operating Target","Operating Target The target amount for operating expenses.
Capital Target The amount of the target in the currency being used.
Budget Key The budget key to which this target applies. Select a key.
Currency The currency in use.
Fiscal period The fiscal period year to which this target applies. Select a fiscal period.",""
"bfe922b5","Artifact","Overrides","Overrides: an amount you can specify to override, or replace, the final forecast amount.",""
"b993bd55","Artifact","Project Financials","Project Financials Budget Model: used to integration with the Project Portfolio Suite (requires the Project Portfolio Suite with Financials (com.snc.financial_planning_pmo) plugin).",""
"id-1686d65d","Artifact","Target Amount","The target amount also appears on the Review tab of the Budget Console. You can edit the amount through the console.",""